<curriculumStandard
        xmlns="https://csmp.missouriwestern.edu"
        xmlns:xsi="http://www.w3.org/2001/XMLSchema-instance"
        xsi:schemaLocation="https://csmp.missouriwestern.edu/xml/curriculum/standard.xsd">
  <name>CompTIA Security + 601 Exam Objectives</name>
  <body>CompTIA</body>
  <version>601</version>
  <documentUrl>https://drive.google.com/file/d/1EOMj_ur0ep3pV9WpxD7jqfCJ9NXgzBm7/view?usp=sharing</documentUrl>
  <knowledgeArea name="Attacks, Threats, and Vulnerabilities"  id="1">
      <topic>Compare and contrast different types of social engineering techniques</topic>
      <topic>Given a scenario, analyze potential indicators to determine the type of attack.</topic>
      <topic>Given a scenario, analyze potential indicators associated with application attacks.</topic>
      <topic>Given a scenario, analyze potential indicators associated with network attacks.</topic>
      <topic>Explain different threat actors, vectors, and intelligence sources.</topic>
      <topic>Explain the security concerns associated with various types of vulnerabilities.</topic>
      <topic>Summarize the techniques used in security assessments.</topic>
      <topic>Explain the techniques used in penetration testing.</topic>      
  </knowledgeArea>
  <knowledgeArea name="Architecture and Design"  id="2">
      <topic>Explain the importance of security concepts in an enterprise environment.</topic>
      <topic>Summarize virtualization and cloud computing concepts.</topic>
      <topic>ESummarize secure application development, deployment, and automation concepts.</topic>
      <topic>Summarize authentication and authorization design concepts.</topic>
      <topic>Given a scenario, implement cybersecurity resilience.</topic>
      <topic>Explain the security implications of embedded and specialized systems.</topic>
      <topic>Explain the importance of physical security controls.</topic>
      <topic>Summarize the basics of cryptographic concepts.</topic>
  </knowledgeArea>
  <knowledgeArea name="Implementation"  id="3">
      <topic>Given a scenario, implement secure protocols.</topic>
      <topic>Given a scenario, implement host or application security solutions.</topic>
      <topic>Given a scenario, implement secure network designs.</topic>
      <topic>Given a scenario, install and configure wireless security settings.</topic>
      <topic>Given a scenario, implement secure mobile solutions.</topic>
      <topic>Given a scenario, apply cybersecurity solutions to the cloud.</topic>
      <topic>Given a scenario, implement identity and account management controls.</topic>
      <topic>Given a scenario, implement authentication and authorization solutions.</topic>
      <topic>Given a scenario, implement public key infrastructure.</topic>
  </knowledgeArea>
  <knowledgeArea name="Operations and Incident Response"  id="4">
      <topic>Given a scenario, use the appropriate tool to assess organizational security.</topic>
      <topic>Summarize the importance of policies, processes, and procedures for incident response.</topic>
      <topic>Given an incident, utilize appropriate data sources to support an investigation.</topic>
      <topic>Given an incident, apply mitigation techniques or controls to secure an environment.</topic>
      <topic>Explain the key aspects of digital forensics.</topic>
  </knowledgeArea>
  <knowledgeArea name="Governance, Risk, and Compliance"  id="5">
      <topic>Compare and contrast various types of controls.</topic>
      <topic>Explain the importance of applicable regulations, standards, or frameworks that impact organizational security posture.</topic>
      <topic>Explain the importance of policies to organizational security.</topic>
      <topic>Summarize risk management processes and concepts.</topic>
      <topic>Explain privacy and sensitive data concepts in relation to security.</topic>
  </knowledgeArea>
</curriculumStandard>
